{
  "annotation_schema_version": "2.0",
  "receipt_id": "3df80da4-8c26-55b4-8bfe-f102bd7bb2f4",
  "dataset_family": "vietreceipt_synthetic",
  "dataset_snapshot": "v0.1",
  "sample_id": "VRSYN-023",
  "synthetic": true,
  "split": "validation",
  "mapping_version": "vietreceipt-canonical-v2",
  "template_id": "layout_b",
  "parent_sample_id": null,
  "fields": {
    "seller_name": {
      "annotation_status": "PRESENT",
      "raw_value": "Cua hang Sao Viet",
      "normalized_value": "Cua hang Sao Viet",
      "source_block_ids": []
    },
    "buyer_name": {
      "annotation_status": "PRESENT",
      "raw_value": "Cong ty Demo Ha Noi",
      "normalized_value": "Cong ty Demo Ha Noi",
      "source_block_ids": []
    },
    "invoice_number": {
      "annotation_status": "PRESENT",
      "raw_value": "HD-0023",
      "normalized_value": "HD-0023",
      "source_block_ids": []
    },
    "invoice_date": {
      "annotation_status": "PRESENT",
      "raw_value": "2026-11-23",
      "normalized_value": "2026-11-23",
      "source_block_ids": []
    },
    "subtotal": {
      "annotation_status": "PRESENT",
      "raw_value": 854000,
      "normalized_value": 854000,
      "source_block_ids": []
    },
    "vat_rate": {
      "annotation_status": "PRESENT",
      "raw_value": "10%",
      "normalized_value": "10%",
      "source_block_ids": []
    },
    "tax_amount": {
      "annotation_status": "PRESENT",
      "raw_value": 85400,
      "normalized_value": 85400,
      "source_block_ids": []
    },
    "total_amount": {
      "annotation_status": "PRESENT",
      "raw_value": 939400,
      "normalized_value": 939400,
      "source_block_ids": []
    }
  },
  "line_items": [
    {
      "line_id": "VRSYN-023-L01",
      "description": {
        "annotation_status": "PRESENT",
        "raw_value": "Muc may in",
        "normalized_value": "Muc may in",
        "source_block_ids": []
      },
      "unit": {
        "annotation_status": "PRESENT",
        "raw_value": "hop",
        "normalized_value": "hop",
        "source_block_ids": []
      },
      "quantity": {
        "annotation_status": "PRESENT",
        "raw_value": 5,
        "normalized_value": 5,
        "source_block_ids": []
      },
      "unit_price": {
        "annotation_status": "PRESENT",
        "raw_value": 145000,
        "normalized_value": 145000,
        "source_block_ids": []
      },
      "amount": {
        "annotation_status": "PRESENT",
        "raw_value": 725000,
        "normalized_value": 725000,
        "source_block_ids": []
      }
    },
    {
      "line_id": "VRSYN-023-L02",
      "description": {
        "annotation_status": "PRESENT",
        "raw_value": "Giay in A4",
        "normalized_value": "Giay in A4",
        "source_block_ids": []
      },
      "unit": {
        "annotation_status": "PRESENT",
        "raw_value": "ream",
        "normalized_value": "ream",
        "source_block_ids": []
      },
      "quantity": {
        "annotation_status": "PRESENT",
        "raw_value": 1,
        "normalized_value": 1,
        "source_block_ids": []
      },
      "unit_price": {
        "annotation_status": "PRESENT",
        "raw_value": 65000,
        "normalized_value": 65000,
        "source_block_ids": []
      },
      "amount": {
        "annotation_status": "PRESENT",
        "raw_value": 65000,
        "normalized_value": 65000,
        "source_block_ids": []
      }
    },
    {
      "line_id": "VRSYN-023-L03",
      "description": {
        "annotation_status": "PRESENT",
        "raw_value": "But bi xanh",
        "normalized_value": "But bi xanh",
        "source_block_ids": []
      },
      "unit": {
        "annotation_status": "PRESENT",
        "raw_value": "cai",
        "normalized_value": "cai",
        "source_block_ids": []
      },
      "quantity": {
        "annotation_status": "PRESENT",
        "raw_value": 2,
        "normalized_value": 2,
        "source_block_ids": []
      },
      "unit_price": {
        "annotation_status": "PRESENT",
        "raw_value": 5000,
        "normalized_value": 5000,
        "source_block_ids": []
      },
      "amount": {
        "annotation_status": "PRESENT",
        "raw_value": 10000,
        "normalized_value": 10000,
        "source_block_ids": []
      }
    },
    {
      "line_id": "VRSYN-023-L04",
      "description": {
        "annotation_status": "PRESENT",
        "raw_value": "So tay",
        "normalized_value": "So tay",
        "source_block_ids": []
      },
      "unit": {
        "annotation_status": "PRESENT",
        "raw_value": "quyen",
        "normalized_value": "quyen",
        "source_block_ids": []
      },
      "quantity": {
        "annotation_status": "PRESENT",
        "raw_value": 3,
        "normalized_value": 3,
        "source_block_ids": []
      },
      "unit_price": {
        "annotation_status": "PRESENT",
        "raw_value": 18000,
        "normalized_value": 18000,
        "source_block_ids": []
      },
      "amount": {
        "annotation_status": "PRESENT",
        "raw_value": 54000,
        "normalized_value": 54000,
        "source_block_ids": []
      }
    }
  ]
}
